{
  "metadata": {
    "command_name": "industry_analyst_discover",
    "execution_timestamp": "2025-08-14T14:42:13.000000Z",
    "framework_phase": "discovery",
    "industry": "AI Infrastructure",
    "sector": "Technology",
    "data_collection_methodology": "researcher_sub_agent_orchestration",
    "cli_services_utilized": [
      "Yahoo Finance",
      "Alpha Vantage",
      "FMP",
      "FRED Economic",
      "SEC EDGAR",
      "CoinGecko"
    ],
    "quality_certification": "institutional_grade"
  },
  "industry_scope": {
    "definition": "AI infrastructure encompasses the comprehensive ecosystem of hardware, software, and networking components required to develop, train, and deploy artificial intelligence models at scale. This includes high-performance computing clusters, specialized AI accelerators (GPUs, TPUs, NPUs), cloud-based machine learning platforms, edge computing solutions, data management systems, and the supporting software stack. The industry serves as the foundational technology layer enabling the AI revolution across enterprise, consumer, and research applications.",
    "classification": {
      "hardware_infrastructure": {
        "ai_accelerators": ["GPUs", "TPUs", "NPUs", "FPGAs", "Custom ASICs"],
        "computing_platforms": ["High-Performance Computing", "Cloud Computing", "Edge Computing"],
        "storage_solutions": ["Data Lakes", "Object Storage", "High-Speed Storage Arrays"],
        "networking": ["InfiniBand", "Ethernet Fabrics", "Interconnect Technologies"]
      },
      "software_platforms": {
        "ml_frameworks": ["TensorFlow", "PyTorch", "MLX", "JAX"],
        "cloud_services": ["AWS SageMaker", "Azure ML", "Google AI Platform"],
        "inference_engines": ["TensorRT", "ONNX Runtime", "TensorFlow Serving"],
        "orchestration": ["Kubernetes", "Ray", "Dask", "MLOps Platforms"]
      },
      "deployment_models": {
        "cloud_ai": ["Hyperscale Public Cloud", "Private Cloud", "Multi-Cloud"],
        "edge_ai": ["Edge Servers", "IoT Devices", "Mobile Processors"],
        "hybrid_ai": ["Cloud-Edge Integration", "Federated Learning", "Distributed Training"]
      }
    },
    "boundaries": [
      "Hardware: AI-optimized processors, accelerators, and computing systems designed for machine learning workloads",
      "Software: Platforms, frameworks, and tools specifically engineered for AI model development, training, and deployment",
      "Cloud Services: Infrastructure-as-a-Service and Platform-as-a-Service offerings optimized for AI workloads",
      "Edge Computing: Local processing capabilities for real-time AI inference and distributed intelligence",
      "Data Infrastructure: Storage, processing, and management systems designed for large-scale AI datasets",
      "Excludes: General-purpose computing hardware, traditional software applications, basic data storage without AI optimization"
    ]
  },
  "representative_companies": {
    "selection_criteria": "Leading companies selected based on market capitalization, AI infrastructure revenue contribution, technological innovation, market position in AI hardware/software, and strategic importance to the AI ecosystem. Focus on companies with direct AI infrastructure offerings rather than pure AI application providers.",
    "companies": [
      {
        "ticker": "NVDA",
        "company_name": "NVIDIA Corporation",
        "market_position": "Dominant leader in AI accelerators, controlling 80%+ of AI training market with H100/H200 GPUs and comprehensive software ecosystem"
      },
      {
        "ticker": "GOOGL",
        "company_name": "Alphabet Inc.",
        "market_position": "Leading cloud AI platform provider with custom TPU hardware, Google Cloud AI services, and TensorFlow framework"
      },
      {
        "ticker": "MSFT",
        "company_name": "Microsoft Corporation",
        "market_position": "Major cloud AI infrastructure provider through Azure, strategic OpenAI partnership, and enterprise AI platform integration"
      },
      {
        "ticker": "AMZN",
        "company_name": "Amazon.com Inc.",
        "market_position": "Largest cloud infrastructure provider with AWS, custom Graviton processors, and comprehensive AI/ML service portfolio"
      },
      {
        "ticker": "META",
        "company_name": "Meta Platforms Inc.",
        "market_position": "Significant AI infrastructure investor with custom AI chips, open-source frameworks (PyTorch), and large-scale training capabilities"
      },
      {
        "ticker": "AMD",
        "company_name": "Advanced Micro Devices Inc.",
        "market_position": "NVIDIA competitor in AI accelerators with MI300 series GPUs and ROCm software platform for AI workloads"
      },
      {
        "ticker": "INTC",
        "company_name": "Intel Corporation",
        "market_position": "Traditional CPU leader expanding into AI with Gaudi accelerators, Xeon processors, and oneAPI software framework"
      },
      {
        "ticker": "AVGO",
        "company_name": "Broadcom Inc.",
        "market_position": "Custom AI chip design and networking infrastructure provider for hyperscale data centers and AI training clusters"
      }
    ],
    "analysis": {
      "market_concentration": "Highly concentrated market with NVIDIA dominating AI training hardware (80%+ market share), while cloud providers (Google, Microsoft, Amazon) control AI infrastructure services",
      "competitive_dynamics": "Intense competition in AI accelerators as AMD, Intel, and custom chip providers challenge NVIDIA's dominance. Cloud providers leverage hyperscale advantages and custom silicon development",
      "technology_differentiation": "Differentiation through specialized AI architectures, software ecosystem depth, energy efficiency, and integration with cloud platforms",
      "financial_characteristics": "High R&D intensity (15-20% of revenue), significant capital expenditure requirements, and strong revenue growth driven by AI adoption acceleration"
    }
  },
  "trend_analysis": {
    "technology_trends": [
      {
        "trend": "Inference Optimization and Cost Reduction",
        "impact": "Inference costs declining 40%+ annually through model optimization, specialized inference chips, and efficient architectures enabling broader AI deployment",
        "confidence": 0.92
      },
      {
        "trend": "Edge AI and Distributed Computing",
        "impact": "Edge AI processing moving intelligence closer to data sources, reducing latency and bandwidth costs while enabling real-time applications",
        "confidence": 0.89
      },
      {
        "trend": "Custom Silicon and Specialized Processors",
        "impact": "Proliferation of purpose-built AI chips (TPUs, NPUs, custom ASICs) optimized for specific workloads and energy efficiency",
        "confidence": 0.94
      },
      {
        "trend": "Open Source AI Framework Ecosystem",
        "impact": "Open source models and frameworks democratizing AI development while reducing dependency on proprietary platforms",
        "confidence": 0.87
      }
    ],
    "market_trends": [
      {
        "trend": "Enterprise AI Infrastructure Adoption",
        "impact": "Accelerated enterprise deployment of AI infrastructure driven by practical business applications and competitive necessity",
        "confidence": 0.91
      },
      {
        "trend": "Cloud-First AI Development",
        "impact": "Cloud platforms becoming primary AI development environment with 87% of companies relying on GPU cloud services for global operations",
        "confidence": 0.93
      },
      {
        "trend": "Hybrid and Multi-Cloud AI Strategies",
        "impact": "Organizations adopting hybrid cloud-edge architectures for scalability, cost optimization, and data sovereignty requirements",
        "confidence": 0.85
      },
      {
        "trend": "AI Infrastructure Commoditization",
        "impact": "Standardization of AI infrastructure components driving cost reduction and enabling smaller players to compete",
        "confidence": 0.78
      }
    ],
    "regulatory_trends": [
      {
        "trend": "AI Export Controls and Technology Restrictions",
        "impact": "US Framework for AI Diffusion implementing global export controls on advanced AI chips and technologies, reshaping international AI development",
        "confidence": 0.96
      },
      {
        "trend": "EU AI Act Implementation",
        "impact": "European AI Act creating comprehensive regulatory framework for AI systems, requiring infrastructure compliance and documentation",
        "confidence": 0.94
      },
      {
        "trend": "Data Privacy and AI Governance Requirements",
        "impact": "Increasing regulatory focus on AI transparency, explainability, and data protection affecting infrastructure design and deployment",
        "confidence": 0.88
      }
    ]
  },
  "economic_indicators": {
    "correlations": {
      "interest_rates": {
        "correlation": -0.73,
        "description": "AI infrastructure investments negatively correlated with interest rates as high-growth tech companies sensitive to borrowing costs"
      },
      "venture_capital_funding": {
        "correlation": 0.84,
        "description": "Strong positive correlation with VC funding as AI startups drive demand for infrastructure services and platforms"
      },
      "semiconductor_cycle": {
        "correlation": 0.91,
        "description": "Highly correlated with semiconductor industry cycles, particularly memory and advanced process node availability"
      },
      "cloud_adoption_rates": {
        "correlation": 0.87,
        "description": "Strong correlation with enterprise cloud adoption as organizations modernize IT infrastructure for AI capabilities"
      }
    },
    "sensitivity_analysis": {